{
  "label": "Myth vs Fact",
  "hook": "Buna hâlâ inanıyor musun?",
  "myth": "Native gibi aksan olmadan IELTS'ten yüksek puan alamazsın.",
  "fact": "Examiner aksana puan vermez; ==anlaşılırlık== ve ==doğal akış== puan getirir.",
  "reason": "Pronunciation kriteri **clarity** ölçer: net telaffuz, doğru vurgu, doğal ritim. Aksan değil.",
  "cta": "Kaydet 🔖 ve inanan arkadaşına gönder",
  "meta": {
    "topic": "accent myth in IELTS",
    "caption": "MYTH: Native gibi aksan olmadan IELTS'ten yüksek puan alamazsın ❌\nFACT: Examiner aksana puan vermez ✅\n\nPronunciation kriteri \"anlaşılırlık\" ölçer: net telaffuz, doğru vurgu, doğal ritim. Türk aksanıyla Band 8 alan yüzlerce öğrenci var.\n\nSen hangi efsaneye inanıyordun? Yorumlara yaz 👇\nKaydet ve bunu hâlâ söyleyen arkadaşına gönder 🔖\n\nIELTS myth busted: your accent is not graded, clarity is.",
    "hashtags": ["#ielts", "#ieltsmyths", "#ahkakademi", "#ingilizce", "#ieltsspeaking", "#learnenglish", "#ieltstips", "#ingilizceöğreniyorum", "#pronunciation", "#toefl", "#englishlearning"],
    "audio_mood": "dramatic 'dun dun' sting on the MYTH stamp, uplifting after the fact"
  }
}
